{
  "method": "method-discriminant",
  "inputs": {
    "relation": {
      "role": "relation"
    },
    "expression": {
      "role": "expression"
    },
    "x": {
      "role": "x"
    },
    "parameter": {
      "role": "parameter"
    },
    "domain": {
      "role": "domain"
    },
    "quantifier": {
      "role": "quantifier"
    },
    "strict": {
      "role": "strict"
    },
    "goal": {
      "role": "goal"
    },
    "constraint_context": {
      "role": "constraint_context"
    }
  },
  "steps": [
    {
      "id": "degree",
      "calls": [],
      "judgments": [
        {
          "id": "degree",
          "function": "degenerate_branches",
          "inputs": {
            "relation": "$relation",
            "variable": "$x",
            "parameter": "$parameter",
            "domain": "$domain",
            "quantifier": "$quantifier"
          },
          "outputs": {
            "degree_cases": "cases",
            "coefficient": "coefficient",
            "has_degenerate": "has_degenerate",
            "degree_evidence": "evidence"
          },
          "options": [
            {
              "id": "nondegenerate"
            },
            {
              "id": "degenerate"
            }
          ],
          "order": 0,
          "depends_on": [
            "relation",
            "x",
            "parameter",
            "domain",
            "quantifier"
          ]
        }
      ],
      "display_units": [
        {
          "id": "case_basis",
          "after": "degree",
          "template": "case_basis",
          "bindings": {
            "before": [],
            "after": [
              "$coefficient"
            ],
            "coefficient": "$coefficient",
            "parameter": "$parameter"
          },
          "depends_on": [
            "coefficient",
            "parameter"
          ],
          "guard": {
            "ref": "has_degenerate",
            "equals": true
          }
        }
      ],
      "cases": {
        "source": "degree_cases",
        "binding": "case",
        "through": "solve",
        "collect": "case_results",
        "outputs": {
          "solution": "$case_solution"
        },
        "entry": {
          "calls": [
            {
              "id": "degenerate",
              "capability": "degenerate_case_check",
              "public_ref": null,
              "inputs": {
                "relation": "$relation",
                "variable": "$x",
                "parameter": "$parameter",
                "case": "$case"
              },
              "outputs": {
                "degenerate_solution": "solution",
                "substituted_relation": "substituted_relation",
                "holds": "holds",
                "linear_coefficient": "linear_coefficient",
                "constant": "constant"
              },
              "order": 0,
              "guard": {
                "ref": "case.kind",
                "equals": "degenerate"
              },
              "skip_reason": "not_selected"
            }
          ],
          "judgments": [],
          "display_units": [
            {
              "id": "degenerate_case",
              "after": "degenerate",
              "template": "degenerate_case",
              "bindings": {
                "before": [
                  "$relation"
                ],
                "after": [
                  "$substituted_relation",
                  "$degenerate_solution"
                ],
                "parameter": "$parameter",
                "value": "$case.value",
                "holds": "$holds",
                "linear_coefficient": "$linear_coefficient",
                "constant": "$constant"
              },
              "depends_on": [
                "case",
                "degenerate_solution",
                "holds",
                "parameter",
                "relation",
                "substituted_relation",
                "linear_coefficient",
                "constant"
              ]
            }
          ],
          "id": "degree"
        }
      }
    },
    {
      "id": "normalize",
      "calls": [
        {
          "id": "move",
          "capability": "normalize_to_zero",
          "public_ref": "skill-inequality-transform",
          "inputs": {
            "relation": "$relation",
            "variable": "$x"
          },
          "outputs": {
            "normalized": "relation",
            "normal_expression": "expression"
          },
          "order": 0
        },
        {
          "id": "simplify",
          "capability": "simplify_expression",
          "public_ref": "skill-simplify",
          "inputs": {
            "expression": "$normal_expression"
          },
          "outputs": {
            "normal_expression": "expression"
          },
          "order": 1
        }
      ],
      "judgments": [],
      "display_units": [
        {
          "id": "normalized",
          "after": "simplify",
          "template": "normalize",
          "bindings": {
            "before": [
              "$relation"
            ],
            "after": [
              "$normalized"
            ]
          },
          "depends_on": [
            "normalized",
            "relation"
          ]
        }
      ],
      "guard": {
        "ref": "case.kind",
        "equals": "nondegenerate"
      }
    },
    {
      "id": "conditions",
      "calls": [
        {
          "id": "opening",
          "capability": "quadratic_sign_condition",
          "public_ref": "skill-quadratic-sign",
          "inputs": {
            "relation": "$normalized",
            "variable": "$x",
            "domain": "$domain",
            "quantifier": "$quantifier",
            "case_domain": "$case.domain",
            "mode": "opening"
          },
          "outputs": {
            "opening": "opening",
            "delta": "delta",
            "sign_expression": "basis_expression"
          },
          "order": 0
        },
        {
          "id": "delta",
          "capability": "quadratic_sign_condition",
          "public_ref": "skill-quadratic-sign",
          "inputs": {
            "relation": "$normalized",
            "variable": "$x",
            "domain": "$domain",
            "quantifier": "$quantifier",
            "case_domain": "$case.domain",
            "mode": "delta"
          },
          "outputs": {
            "delta_condition": "condition",
            "delta": "delta"
          },
          "order": 1
        },
        {
          "id": "simplify",
          "capability": "simplify_expression",
          "public_ref": "skill-simplify",
          "inputs": {
            "expression": "$delta"
          },
          "outputs": {
            "delta": "expression"
          },
          "order": 2
        },
        {
          "id": "transform",
          "capability": "transform_param_inequality",
          "public_ref": "skill-inequality-transform",
          "inputs": {
            "relation": "$delta_condition",
            "variable": "$parameter"
          },
          "outputs": {
            "parameter_condition": "relation",
            "parameter_polynomial": "expression"
          },
          "order": 3
        }
      ],
      "judgments": [],
      "display_units": [
        {
          "id": "opening",
          "after": "opening",
          "template": "opening",
          "bindings": {
            "before": [],
            "after": [
              "$opening"
            ],
            "strict": "$strict",
            "relation": "$normalized",
            "expression": "$sign_expression"
          },
          "depends_on": [
            "opening",
            "strict",
            "normalized",
            "sign_expression"
          ]
        },
        {
          "id": "discriminant",
          "after": "transform",
          "template": "discriminant",
          "bindings": {
            "before": [
              "$delta_condition"
            ],
            "after": [
              "$parameter_condition"
            ]
          },
          "depends_on": [
            "delta_condition",
            "parameter_condition"
          ]
        }
      ],
      "guard": {
        "ref": "case.kind",
        "equals": "nondegenerate"
      }
    },
    {
      "id": "solve",
      "calls": [
        {
          "id": "simplify",
          "capability": "simplify_expression",
          "public_ref": "skill-simplify",
          "inputs": {},
          "outputs": {},
          "guard": {
            "all": [
              {
                "ref": "case.kind",
                "equals": "nondegenerate"
              },
              {
                "constant": false
              }
            ]
          },
          "skip_reason": "already_satisfied",
          "order": 0
        },
        {
          "id": "transform",
          "capability": "normalize_to_zero",
          "public_ref": "skill-inequality-transform",
          "inputs": {},
          "outputs": {},
          "guard": {
            "all": [
              {
                "ref": "case.kind",
                "equals": "nondegenerate"
              },
              {
                "constant": false
              }
            ]
          },
          "skip_reason": "already_satisfied",
          "order": 1
        },
        {
          "id": "solve",
          "capability": "submethod",
          "public_ref": "quadratic-inequality-solve",
          "inputs": {
            "relation": "$parameter_condition",
            "variable": "$parameter"
          },
          "outputs": {
            "quadratic_solution": "solution"
          },
          "order": 2,
          "guard": {
            "all": [
              {
                "ref": "case.kind",
                "equals": "nondegenerate"
              },
              {
                "ref": "parameter_solver",
                "equals": "quadratic"
              }